{
  "name": "App Product Metrics",
  "description": "Track user activation, engagement, and product usage for app.sylph.ai",
  "domain_filter": "app.sylph.ai",
  "dashboard_id": 1166740,
  "insights": [
    {
      "name": "App Unique Users (Total)",
      "type": "unique_users",
      "display": "BoldNumber",
      "date_range": "-30d"
    },
    {
      "name": "App Pageviews (Total)",
      "type": "pageviews_total",
      "display": "BoldNumber",
      "date_range": "-30d"
    },
    {
      "name": "Daily Active Users",
      "type": "traffic_trend",
      "display": "ActionsLineGraph",
      "math": "dau",
      "date_range": "-30d"
    },
    {
      "name": "Top App Pages",
      "type": "top_pages",
      "display": "ActionsTable",
      "breakdown": "$current_url",
      "date_range": "-30d"
    },
    {
      "name": "Weekly Active Users",
      "type": "unique_users",
      "display": "BoldNumber",
      "math": "weekly_active",
      "date_range": "-30d"
    },
    {
      "name": "App Session Count",
      "type": "pageviews_total",
      "display": "ActionsLineGraph",
      "event": "$pageview",
      "date_range": "-7d"
    }
  ]
}
